{
  "id": "6a7b8c9d-0000-4000-8000-000000000005",
  "assignment_uri": "https://grip.opdrachtgever.example/id/opdracht/3f2a8c54-6d1b-4f0e-9a77-1c2b3d4e5f60",
  "period": {
    "start_date": "2026-07-01",
    "end_date": "2027-06-30"
  },
  "agreed": [
    "Bouwsteen Alfa in productie"
  ],
  "delivered": [
    "Bouwsteen Alfa in productie"
  ],
  "not_delivered": [
    {
      "description": "Koppeling met register Beta",
      "reason": "Register was niet op tijd beschikbaar."
    }
  ],
  "total_cost": {
    "amount_cents": 110000000,
    "currency": "EUR"
  },
  "summary": "Fictief eindrapport.",
  "issued_at": "2027-07-15T16:00:00+02:00"
}
